{
  "$schema": "https://json-schema.org/draft/2020-12/schema",
  "$id": "https://egohygiene.github.io/renderflow/schemas/renderflow-golden-corpus-v1.schema.json",
  "title": "Renderflow golden artifact corpus v1",
  "type": "object",
  "additionalProperties": false,
  "required": ["schema_version", "corpus_version", "license", "redistribution", "fixtures", "collections", "scenarios"],
  "properties": {
    "schema_version": { "const": "renderflow.golden-corpus/v1" },
    "corpus_version": { "type": "string", "pattern": "^[0-9]+\\.[0-9]+\\.[0-9]+$" },
    "license": { "const": "CC0-1.0" },
    "redistribution": { "type": "string", "minLength": 1 },
    "fixtures": {
      "type": "array",
      "minItems": 1,
      "items": { "$ref": "#/$defs/fixture" }
    },
    "collections": {
      "type": "array",
      "items": { "$ref": "#/$defs/collection" }
    },
    "scenarios": {
      "type": "array",
      "minItems": 1,
      "items": { "$ref": "#/$defs/scenario" }
    }
  },
  "$defs": {
    "fixture": {
      "type": "object",
      "additionalProperties": false,
      "required": ["id", "filename", "encoding", "payload", "expected_media_type", "family", "expected_outcome"],
      "properties": {
        "id": { "type": "string", "pattern": "^fixture\\.[a-z0-9.-]+$" },
        "filename": { "type": "string", "minLength": 1 },
        "encoding": { "enum": ["utf8", "hex"] },
        "payload": { "type": "string" },
        "sha256": { "type": "string", "pattern": "^[0-9a-f]{64}$" },
        "expected_format": { "type": "string", "minLength": 1 },
        "expected_media_type": { "type": "string", "pattern": "^[^/]+/[^/]+$" },
        "family": { "type": "string", "minLength": 1 },
        "expected_outcome": { "enum": ["accepted", "conflict", "rejected"] },
        "expected_diagnostic": { "type": "string", "minLength": 1 }
      }
    },
    "collection": {
      "type": "object",
      "additionalProperties": false,
      "required": ["id", "members"],
      "properties": {
        "id": { "type": "string", "pattern": "^fixture\\.collection\\.[a-z0-9.-]+$" },
        "members": { "type": "array", "minItems": 1, "items": { "type": "string" } }
      }
    },
    "scenario": {
      "type": "object",
      "additionalProperties": false,
      "required": ["id", "tier", "fixtures"],
      "properties": {
        "id": { "type": "string", "pattern": "^[a-z0-9_]+$" },
        "tier": { "enum": ["fast", "tool_backed", "maximal"] },
        "fixtures": { "type": "array", "minItems": 1, "items": { "type": "string" } },
        "expected_artifacts": {
          "type": "array",
          "minItems": 1,
          "items": { "$ref": "#/$defs/expectedArtifact" }
        }
      }
    },
    "expectedArtifact": {
      "type": "object",
      "additionalProperties": false,
      "required": ["case_id", "role", "format", "media_type", "provider_id", "oracle_path", "source_ids"],
      "properties": {
        "case_id": { "type": "string", "pattern": "^[a-z0-9_]+$" },
        "role": { "type": "string", "pattern": "^[a-z0-9_-]+$" },
        "format": { "type": "string", "minLength": 1 },
        "media_type": { "type": "string", "pattern": "^[^/]+/[^/]+$" },
        "provider_id": { "type": "string", "pattern": "^tool\\.[a-z0-9.-]+$" },
        "provider_version": { "type": "string", "minLength": 1 },
        "oracle_path": { "type": "string", "pattern": "^expected/(?:[a-z0-9_-]+/)*[a-z0-9_-]+(?:\\.[a-z0-9_-]+)+$" },
        "source_ids": {
          "type": "array",
          "minItems": 1,
          "uniqueItems": true,
          "items": { "type": "string", "pattern": "^fixture\\.[a-z0-9.-]+$" }
        }
      }
    }
  }
}
